{
  "schema_version": "solar.layout.request/1",
  "name": "One table excluded",
  "frame": {
    "kind": "local_cartesian",
    "id": "local:analytic-site",
    "units": "m",
    "axes": {
      "x": "east",
      "y": "north"
    }
  },
  "boundary": {
    "type": "Polygon",
    "coordinates": [
      [
        [
          0,
          0
        ],
        [
          12,
          0
        ],
        [
          12,
          14
        ],
        [
          0,
          14
        ],
        [
          0,
          0
        ]
      ]
    ]
  },
  "perimeter_setback_m": 1.0,
  "exclusions": [
    {
      "id": "EX-1",
      "geometry": {
        "type": "Polygon",
        "coordinates": [
          [
            [
              4,
              1
            ],
            [
              6,
              1
            ],
            [
              6,
              5
            ],
            [
              4,
              5
            ],
            [
              4,
              1
            ]
          ]
        ]
      },
      "keepout_m": 0.0
    }
  ],
  "module": {
    "model_id": "SYNTHETIC-1x2-550",
    "width_m": 1.0,
    "length_m": 2.0,
    "power_wp": 550.0,
    "orientation": "portrait"
  },
  "table": {
    "rows": 2,
    "columns": 2,
    "module_gap_x_m": 0.0,
    "module_gap_y_m": 0.0,
    "tilt_deg": 0.0,
    "facing_azimuth_deg": 180.0,
    "lower_edge_height_m": 0.8
  },
  "placement": {
    "mode": "fixed_lattice",
    "anchor_xy_m": [
      1.0,
      1.0
    ],
    "table_gap_m": 1.0,
    "row_pitch_m": 5.0,
    "minimum_clear_row_gap_m": 1.0
  }
}
